{
    "loopDelay": 10000,
    "contractsJsonFile": "../../../fasset-deployment/coston.json",
    "prioritizeAddressUpdater": false,
    "nativeChainInfo": {
        "finalizationBlocks": 6,
        "readLogsChunkSize": 10
    },
    "fAssetInfos": [
        {
            "chainId": "testXRP",
            "name": "Test XRP",
            "symbol": "testXRP",
            "fAssetSymbol": "FtestXRP",
            "indexerUrl": "https://attestation-coston.aflabs.net/verifier/xrp"
        },
        {
            "chainId": "testXRP",
            "name": "Fake XRP",
            "symbol": "fakeXRP",
            "fAssetSymbol": "FfakeXRP",
            "indexerUrl": "https://attestation-coston.aflabs.net/verifier/xrp",
            "priceChangeEmitter": "FakePriceReader"
        }
    ],
    "rpcUrl": "https://coston-api.flare.network/ext/C/rpc",
    "attestationProviderUrls": [
        "https://attestation-coston.aflabs.net/attestation-client"
    ]
}
